[
    {
        "id": "1610940502609723393",
        "url": "https://x.com/Recuenco/status/1610940502609723393",
        "replies": 0,
        "likes": 402,
        "bookmarks": 0,
        "views": 123618,
        "summary": "¿Pueden los CFOs ser estratégicos? Sin duda aportan ventaja competitiva",
        "categories": [
            "estrategia"
        ],
        "related_threads": [
            "1667419646671179776",
            "1746066280782631368"
        ]
    },
    {
        "id": "1604019306349592577",
        "url": "https://x.com/Recuenco/status/1604019306349592577",
        "replies": 0,
        "likes": 705,
        "bookmarks": 0,
        "views": 170995,
        "summary": "Factor humano y su conexión con el CPS",
        "categories": [
            "factor-x"
        ],
        "related_threads": [
            "1669966506208161793"
        ]
    },
    {
        "id": "1601483220029161473",
        "url": "https://x.com/Recuenco/status/1601483220029161473",
        "replies": 0,
        "likes": 637,
        "bookmarks": 0,
        "views": 0,
        "summary": "Gaming, Crypto, CPS. Todos somos putos gamers desde que nacemos",
        "categories": [
            "gaming"
        ],
        "related_threads": []
    },
    {
        "id": "1598965646620086272",
        "url": "https://x.com/Recuenco/status/1598965646620086272",
        "replies": 0,
        "likes": 891,
        "bookmarks": 0,
        "views": 0,
        "summary": "Conformidad, lubricación social y sus dinámicas. Los adolescentes y sus películas de vaqueros",
        "categories": [
            "sistemas-complejos",
            "factor-x"
        ],
        "related_threads": []
    },
    {
        "id": "1596391703774367744",
        "url": "https://x.com/Recuenco/status/1596391703774367744",
        "replies": 0,
        "likes": 509,
        "bookmarks": 0,
        "views": 0,
        "summary": "El umbral entre la complejidad y la serendipia",
        "categories": [
            "sistemas-complejos",
            "lectura-de-señales"
        ],
        "related_threads": [
            "1796796569829687349"
        ]
    },
    {
        "id": "1593870067128627200",
        "url": "https://x.com/Recuenco/status/1593870067128627200",
        "replies": 0,
        "likes": 360,
        "bookmarks": 0,
        "views": 0,
        "summary": "Visiones y su ejecución, la importancia ambas y la distancia que las separa",
        "categories": [
            "estrategia",
            "gestión-del-talento"
        ],
        "related_threads": [
            "1596391703774367744"
        ]
    },
    {
        "id": "1591345649848487936",
        "url": "https://x.com/Recuenco/status/1591345649848487936",
        "replies": 0,
        "likes": 517,
        "bookmarks": 0,
        "views": 0,
        "summary": "Spaghetti alle vongole, gestión de lo desconocido en CPS: la idea de comprobar el punto de cocción tirando la pasta en la pared",
        "categories": [
            "sistemas-complejos",
            "resolución-de-problemas-complejos"
        ],
        "related_threads": []
    },
    {
        "id": "1588784557284794368",
        "url": "https://x.com/Recuenco/status/1588784557284794368",
        "replies": 0,
        "likes": 780,
        "bookmarks": 0,
        "views": 0,
        "summary": "Monetización de redes sociales y las ecuaciones de canje de valor",
        "categories": [
            "factor-x"
        ],
        "related_threads": []
    },
    {
        "id": "1586258861190676482",
        "url": "https://x.com/Recuenco/status/1586258861190676482",
        "replies": 0,
        "likes": 372,
        "bookmarks": 0,
        "views": 0,
        "summary": "La vaca se ordeña siempre de la misma manera hasta que revienta",
        "categories": [
            "lectura-de-señales",
            "marketing",
            "factor-x"
        ],
        "related_threads": []
    },
    {
        "id": "1583704982129643520",
        "url": "https://x.com/Recuenco/status/1583704982129643520",
        "replies": 0,
        "likes": 1032,
        "bookmarks": 0,
        "views": 0,
        "summary": "La agilidad mental, rutinas, peligro y stress",
        "categories": [
            "sistemas-complejos"
        ],
        "related_threads": []
    },
    {
        "id": "1581161865035407360",
        "url": "https://x.com/Recuenco/status/1581161865035407360",
        "replies": 0,
        "likes": 368,
        "bookmarks": 0,
        "views": 0,
        "summary": "Importancia del cuerpo calloso y el Test Astudillo",
        "categories": [
            "sistemas-complejos",
            "factor-x"
        ],
        "related_threads": [
            "1763816753929347384"
        ]
    },
    {
        "id": "1578640745979846662",
        "url": "https://x.com/Recuenco/status/1578640745979846662",
        "replies": 0,
        "likes": 1182,
        "bookmarks": 0,
        "views": 0,
        "summary": "La importancia del recalibrado en escenarios CPS, recoger cable, inversiones de ego y la arquitectura mental Antonio Escohotado",
        "categories": [
            "resolución-de-problemas-complejos",
            "factor-x"
        ],
        "related_threads": []
    },
    {
        "id": "1576087451524907008",
        "url": "https://x.com/Recuenco/status/1576087451524907008",
        "replies": 0,
        "likes": 661,
        "bookmarks": 0,
        "views": 0,
        "summary": "Quién fue la Primera persona que intentó crear una compañía en torno a CPS",
        "categories": [
            "resolución-de-problemas-complejos"
        ],
        "related_threads": []
    },
    {
        "id": "1573548479888105473",
        "url": "https://x.com/Recuenco/status/1573548479888105473",
        "replies": 0,
        "likes": 371,
        "bookmarks": 0,
        "views": 0,
        "summary": "La selección española de baloncesto y su trayectoria en el Eurobasket, ignorando tres aproximaciones: épica testosterónica, colectivo-sindical, anomalía estadística negricísnea",
        "categories": [
            "trabajo-en-equipo"
        ],
        "related_threads": []
    },
    {
        "id": "1571042180965498881",
        "url": "https://x.com/Recuenco/status/1571042180965498881",
        "replies": 0,
        "likes": 255,
        "bookmarks": 0,
        "views": 0,
        "summary": "Los tuercebotas y casting mal hechos, junto con el italiano por su musicalidad y expresiones intraducibles como 'Manca finezza'",
        "categories": [
            "sistemas-complejos"
        ],
        "related_threads": [
            "1610940502609723393"
        ]
    },
    {
        "id": "1568482191230787585",
        "url": "https://x.com/Recuenco/status/1568482191230787585",
        "replies": 0,
        "likes": 346,
        "bookmarks": 0,
        "views": 0,
        "summary": "Factor X: Mujeres, primates y científicos. Ningun colectivo sin ofensa",
        "categories": [
            "factor-x"
        ],
        "related_threads": [
            "1604019306349592577"
        ]
    },
    {
        "id": "1550748648845238272",
        "url": "https://x.com/Recuenco/status/1550748648845238272",
        "replies": 0,
        "likes": 726,
        "bookmarks": 0,
        "views": 0,
        "summary": "Los equipos de fútbol invirtiendo en talento y la ilusión de los fans al fichar un delantero en lugar de un defensa",
        "categories": [
            "gestión-del-talento",
            "factor-x"
        ],
        "related_threads": []
    },
    {
        "id": "1545639451765997568",
        "url": "https://x.com/Recuenco/status/1545639451765997568",
        "replies": 0,
        "likes": 276,
        "bookmarks": 0,
        "views": 0,
        "summary": "Emoción en el CPS",
        "categories": [
            "personotecnia"
        ],
        "related_threads": []
    },
    {
        "id": "1543107844043673600",
        "url": "https://x.com/Recuenco/status/1543107844043673600",
        "replies": 0,
        "likes": 410,
        "bookmarks": 0,
        "views": 0,
        "summary": "Complejidad vs. aleatoriedad: La ampliamente usada complejidad de Kolmogorov es simplemente una medida de la aleatoriedad",
        "categories": [
            "sistemas-complejos"
        ],
        "related_threads": [
            "1784107483444687237"
        ]
    },
    {
        "id": "1540473939503288321",
        "url": "https://x.com/Recuenco/status/1540473939503288321",
        "replies": 0,
        "likes": 214,
        "bookmarks": 0,
        "views": 0,
        "summary": "Discutiendo el Draft de la NBA como un festival CPS",
        "categories": [
            "orquestación-cognitiva"
        ],
        "related_threads": []
    },
    {
        "id": "1538038532874420225",
        "url": "https://x.com/Recuenco/status/1538038532874420225",
        "replies": 0,
        "likes": 332,
        "bookmarks": 0,
        "views": 0,
        "summary": "La violencia intelectual. Aclara que hay un montón de gente usando el término en contextos de los más variopintos",
        "categories": [
            "factor-x"
        ],
        "related_threads": []
    },
    {
        "id": "1535521789585117185",
        "url": "https://x.com/Recuenco/status/1535521789585117185",
        "replies": 0,
        "likes": 672,
        "bookmarks": 0,
        "views": 0,
        "summary": "Examinando dinámicas de creación y sustentación de opinión",
        "categories": [
            "factor-x"
        ],
        "related_threads": []
    },
    {
        "id": "1532990633580929025",
        "url": "https://x.com/Recuenco/status/1532990633580929025",
        "replies": 0,
        "likes": 724,
        "bookmarks": 0,
        "views": 0,
        "summary": "Tratando un tema liviano: cómo escribir todas las semanas sobre algo, incluso estando muerto o cansado",
        "categories": [
            "resolución-de-problemas-complejos"
        ],